{
  "$schema": "../../schema/meta.schema.json",
  "id": 392,
  "slug": "binary-tree-preorder-traversal",
  "title": "Binary Tree Preorder Traversal",
  "difficulty": "easy",
  "tags": [
    "trees",
    "dfs",
    "stack"
  ],
  "companies": [
    "microsoft",
    "amazon"
  ],
  "target_minutes": 10,
  "signature": {
    "function": "preorder_traversal",
    "params": [
      {
        "name": "root",
        "type": "TreeNode"
      }
    ],
    "returns": "int[]"
  },
  "statement": "statement.md",
  "hints": "hints.md",
  "explanation": "explanation.md",
  "tests": "tests.json",
  "languages": {
    "python": {
      "boilerplate": "boilerplate/python.py",
      "solution": "solutions/python.py"
    },
    "javascript": {
      "boilerplate": "boilerplate/javascript.js",
      "solution": "solutions/javascript.js"
    },
    "typescript": {
      "boilerplate": "boilerplate/typescript.ts",
      "solution": "solutions/typescript.ts"
    },
    "java": {
      "boilerplate": "boilerplate/java.java",
      "solution": "solutions/java.java"
    },
    "cpp": {
      "boilerplate": "boilerplate/cpp.cpp",
      "solution": "solutions/cpp.cpp"
    },
    "go": {
      "boilerplate": "boilerplate/go.go",
      "solution": "solutions/go.go"
    }
  }
}
