{
  "$schema": "../../schema/meta.schema.json",
  "id": 446,
  "slug": "check-if-a-word-occurs-as-a-prefix-of-any-word-in-a-sentence",
  "title": "Check If a Word Occurs As a Prefix of Any Word in a Sentence",
  "difficulty": "easy",
  "tags": [
    "strings",
    "trie",
    "two-pointers"
  ],
  "companies": [
    "yelp",
    "amazon"
  ],
  "target_minutes": 12,
  "signature": {
    "function": "is_prefix_of_word",
    "params": [
      {
        "name": "sentence",
        "type": "string"
      },
      {
        "name": "search_word",
        "type": "string"
      }
    ],
    "returns": "int"
  },
  "statement": "statement.md",
  "hints": "hints.md",
  "explanation": "explanation.md",
  "tests": "tests.json",
  "languages": {
    "python": {
      "boilerplate": "boilerplate/python.py",
      "solution": "solutions/python.py"
    },
    "javascript": {
      "boilerplate": "boilerplate/javascript.js",
      "solution": "solutions/javascript.js"
    },
    "typescript": {
      "boilerplate": "boilerplate/typescript.ts",
      "solution": "solutions/typescript.ts"
    },
    "java": {
      "boilerplate": "boilerplate/java.java",
      "solution": "solutions/java.java"
    },
    "cpp": {
      "boilerplate": "boilerplate/cpp.cpp",
      "solution": "solutions/cpp.cpp"
    },
    "go": {
      "boilerplate": "boilerplate/go.go",
      "solution": "solutions/go.go"
    }
  }
}
