{
  "$schema": "../../schema/meta.schema.json",
  "id": 175,
  "slug": "four-sum",
  "title": "4Sum",
  "difficulty": "medium",
  "tags": [
    "arrays",
    "two-pointers",
    "sorting"
  ],
  "companies": [
    "amazon",
    "apple",
    "adobe"
  ],
  "target_minutes": 25,
  "signature": {
    "function": "four_sum",
    "params": [
      {
        "name": "nums",
        "type": "int[]"
      },
      {
        "name": "target",
        "type": "int"
      }
    ],
    "returns": "int[][]"
  },
  "compare": "unordered_deep",
  "statement": "statement.md",
  "hints": "hints.md",
  "explanation": "explanation.md",
  "tests": "tests.json",
  "languages": {
    "python": {
      "boilerplate": "boilerplate/python.py",
      "solution": "solutions/python.py"
    },
    "javascript": {
      "boilerplate": "boilerplate/javascript.js",
      "solution": "solutions/javascript.js"
    },
    "typescript": {
      "boilerplate": "boilerplate/typescript.ts",
      "solution": "solutions/typescript.ts"
    },
    "java": {
      "boilerplate": "boilerplate/java.java",
      "solution": "solutions/java.java"
    },
    "cpp": {
      "boilerplate": "boilerplate/cpp.cpp",
      "solution": "solutions/cpp.cpp"
    },
    "go": {
      "boilerplate": "boilerplate/go.go",
      "solution": "solutions/go.go"
    }
  }
}
