{
  "$schema": "../../schema/meta.schema.json",
  "id": 435,
  "slug": "construct-binary-search-tree-from-preorder-traversal",
  "title": "Construct Binary Search Tree from Preorder Traversal",
  "difficulty": "medium",
  "tags": [
    "trees",
    "binary-search-tree",
    "stack",
    "monotonic-stack"
  ],
  "companies": [
    "amazon",
    "microsoft",
    "meta"
  ],
  "target_minutes": 25,
  "signature": {
    "function": "bst_from_preorder",
    "params": [
      {
        "name": "preorder",
        "type": "int[]"
      }
    ],
    "returns": "TreeNode"
  },
  "compare": "exact",
  "statement": "statement.md",
  "hints": "hints.md",
  "explanation": "explanation.md",
  "tests": "tests.json",
  "languages": {
    "python": {
      "boilerplate": "boilerplate/python.py",
      "solution": "solutions/python.py"
    },
    "javascript": {
      "boilerplate": "boilerplate/javascript.js",
      "solution": "solutions/javascript.js"
    },
    "typescript": {
      "boilerplate": "boilerplate/typescript.ts",
      "solution": "solutions/typescript.ts"
    },
    "java": {
      "boilerplate": "boilerplate/java.java",
      "solution": "solutions/java.java"
    },
    "cpp": {
      "boilerplate": "boilerplate/cpp.cpp",
      "solution": "solutions/cpp.cpp"
    },
    "go": {
      "boilerplate": "boilerplate/go.go",
      "solution": "solutions/go.go"
    }
  }
}
