{
  "$schema": "../../schema/meta.schema.json",
  "id": 137,
  "slug": "find-lucky-integer-in-an-array",
  "title": "Find Lucky Integer in an Array",
  "difficulty": "easy",
  "tags": [
    "arrays",
    "hash-map",
    "counting"
  ],
  "companies": [
    "microsoft",
    "amazon"
  ],
  "target_minutes": 12,
  "signature": {
    "function": "find_lucky",
    "params": [
      {
        "name": "arr",
        "type": "int[]"
      }
    ],
    "returns": "int"
  },
  "statement": "statement.md",
  "hints": "hints.md",
  "explanation": "explanation.md",
  "tests": "tests.json",
  "languages": {
    "python": {
      "boilerplate": "boilerplate/python.py",
      "solution": "solutions/python.py"
    },
    "javascript": {
      "boilerplate": "boilerplate/javascript.js",
      "solution": "solutions/javascript.js"
    },
    "typescript": {
      "boilerplate": "boilerplate/typescript.ts",
      "solution": "solutions/typescript.ts"
    },
    "java": {
      "boilerplate": "boilerplate/java.java",
      "solution": "solutions/java.java"
    },
    "cpp": {
      "boilerplate": "boilerplate/cpp.cpp",
      "solution": "solutions/cpp.cpp"
    },
    "go": {
      "boilerplate": "boilerplate/go.go",
      "solution": "solutions/go.go"
    }
  }
}
