{
  "$schema": "../../schema/meta.schema.json",
  "id": 455,
  "slug": "lexicographical-numbers",
  "title": "Lexicographical Numbers",
  "difficulty": "medium",
  "tags": [
    "trie",
    "dfs"
  ],
  "companies": [
    "bloomberg",
    "google",
    "tiktok"
  ],
  "target_minutes": 20,
  "signature": {
    "function": "lexical_order",
    "params": [
      {
        "name": "n",
        "type": "int"
      }
    ],
    "returns": "int[]"
  },
  "statement": "statement.md",
  "hints": "hints.md",
  "explanation": "explanation.md",
  "tests": "tests.json",
  "languages": {
    "python": {
      "boilerplate": "boilerplate/python.py",
      "solution": "solutions/python.py"
    },
    "javascript": {
      "boilerplate": "boilerplate/javascript.js",
      "solution": "solutions/javascript.js"
    },
    "typescript": {
      "boilerplate": "boilerplate/typescript.ts",
      "solution": "solutions/typescript.ts"
    },
    "java": {
      "boilerplate": "boilerplate/java.java",
      "solution": "solutions/java.java"
    },
    "cpp": {
      "boilerplate": "boilerplate/cpp.cpp",
      "solution": "solutions/cpp.cpp"
    },
    "go": {
      "boilerplate": "boilerplate/go.go",
      "solution": "solutions/go.go"
    }
  }
}
