{
  "$schema": "../../schema/meta.schema.json",
  "id": 140,
  "slug": "four-sum-ii",
  "title": "4Sum II",
  "difficulty": "medium",
  "tags": [
    "arrays",
    "hash-map"
  ],
  "companies": [
    "amazon",
    "adobe"
  ],
  "target_minutes": 20,
  "signature": {
    "function": "four_sum_count",
    "params": [
      {
        "name": "nums1",
        "type": "int[]"
      },
      {
        "name": "nums2",
        "type": "int[]"
      },
      {
        "name": "nums3",
        "type": "int[]"
      },
      {
        "name": "nums4",
        "type": "int[]"
      }
    ],
    "returns": "int"
  },
  "statement": "statement.md",
  "hints": "hints.md",
  "explanation": "explanation.md",
  "tests": "tests.json",
  "languages": {
    "python": {
      "boilerplate": "boilerplate/python.py",
      "solution": "solutions/python.py"
    },
    "javascript": {
      "boilerplate": "boilerplate/javascript.js",
      "solution": "solutions/javascript.js"
    },
    "typescript": {
      "boilerplate": "boilerplate/typescript.ts",
      "solution": "solutions/typescript.ts"
    },
    "java": {
      "boilerplate": "boilerplate/java.java",
      "solution": "solutions/java.java"
    },
    "cpp": {
      "boilerplate": "boilerplate/cpp.cpp",
      "solution": "solutions/cpp.cpp"
    },
    "go": {
      "boilerplate": "boilerplate/go.go",
      "solution": "solutions/go.go"
    }
  }
}
