{
  "$schema": "../../schema/meta.schema.json",
  "id": 301,
  "slug": "baseball-game",
  "title": "Baseball Game",
  "difficulty": "easy",
  "tags": [
    "stack",
    "simulation",
    "arrays"
  ],
  "companies": [
    "amazon",
    "bloomberg"
  ],
  "target_minutes": 12,
  "signature": {
    "function": "cal_points",
    "params": [
      {
        "name": "operations",
        "type": "string[]"
      }
    ],
    "returns": "int"
  },
  "statement": "statement.md",
  "hints": "hints.md",
  "explanation": "explanation.md",
  "tests": "tests.json",
  "languages": {
    "python": {
      "boilerplate": "boilerplate/python.py",
      "solution": "solutions/python.py"
    },
    "javascript": {
      "boilerplate": "boilerplate/javascript.js",
      "solution": "solutions/javascript.js"
    },
    "typescript": {
      "boilerplate": "boilerplate/typescript.ts",
      "solution": "solutions/typescript.ts"
    },
    "java": {
      "boilerplate": "boilerplate/java.java",
      "solution": "solutions/java.java"
    },
    "cpp": {
      "boilerplate": "boilerplate/cpp.cpp",
      "solution": "solutions/cpp.cpp"
    },
    "go": {
      "boilerplate": "boilerplate/go.go",
      "solution": "solutions/go.go"
    }
  }
}
