{
  "$schema": "../../schema/meta.schema.json",
  "id": 235,
  "slug": "number-of-submatrices-that-sum-to-target",
  "title": "Number of Submatrices That Sum to Target",
  "difficulty": "hard",
  "tags": [
    "matrix",
    "prefix-sum",
    "hash-map"
  ],
  "companies": [
    "google",
    "meta",
    "amazon"
  ],
  "target_minutes": 40,
  "signature": {
    "function": "num_submatrix_sum_target",
    "params": [
      {
        "name": "matrix",
        "type": "int[][]"
      },
      {
        "name": "target",
        "type": "int"
      }
    ],
    "returns": "int"
  },
  "statement": "statement.md",
  "hints": "hints.md",
  "explanation": "explanation.md",
  "tests": "tests.json",
  "languages": {
    "python": {
      "boilerplate": "boilerplate/python.py",
      "solution": "solutions/python.py"
    },
    "javascript": {
      "boilerplate": "boilerplate/javascript.js",
      "solution": "solutions/javascript.js"
    },
    "typescript": {
      "boilerplate": "boilerplate/typescript.ts",
      "solution": "solutions/typescript.ts"
    },
    "java": {
      "boilerplate": "boilerplate/java.java",
      "solution": "solutions/java.java"
    },
    "cpp": {
      "boilerplate": "boilerplate/cpp.cpp",
      "solution": "solutions/cpp.cpp"
    },
    "go": {
      "boilerplate": "boilerplate/go.go",
      "solution": "solutions/go.go"
    }
  }
}
