{
  "$schema": "../../schema/meta.schema.json",
  "id": 328,
  "slug": "next-greater-node-in-linked-list",
  "title": "Next Greater Node in Linked List",
  "difficulty": "medium",
  "tags": [
    "stack",
    "monotonic-stack",
    "linked-list"
  ],
  "companies": [
    "amazon",
    "microsoft"
  ],
  "target_minutes": 25,
  "signature": {
    "function": "next_larger_nodes",
    "params": [
      {
        "name": "head",
        "type": "ListNode"
      }
    ],
    "returns": "int[]"
  },
  "compare": "exact",
  "statement": "statement.md",
  "hints": "hints.md",
  "explanation": "explanation.md",
  "tests": "tests.json",
  "languages": {
    "python": {
      "boilerplate": "boilerplate/python.py",
      "solution": "solutions/python.py"
    },
    "javascript": {
      "boilerplate": "boilerplate/javascript.js",
      "solution": "solutions/javascript.js"
    },
    "typescript": {
      "boilerplate": "boilerplate/typescript.ts",
      "solution": "solutions/typescript.ts"
    },
    "java": {
      "boilerplate": "boilerplate/java.java",
      "solution": "solutions/java.java"
    },
    "cpp": {
      "boilerplate": "boilerplate/cpp.cpp",
      "solution": "solutions/cpp.cpp"
    },
    "go": {
      "boilerplate": "boilerplate/go.go",
      "solution": "solutions/go.go"
    }
  }
}
