{
  "$schema": "../../schema/meta.schema.json",
  "id": 477,
  "slug": "single-threaded-cpu",
  "title": "Single-Threaded CPU",
  "difficulty": "medium",
  "tags": [
    "heap",
    "sorting",
    "simulation"
  ],
  "companies": [
    "amazon",
    "google"
  ],
  "target_minutes": 25,
  "signature": {
    "function": "get_order",
    "params": [
      {
        "name": "tasks",
        "type": "int[][]"
      }
    ],
    "returns": "int[]"
  },
  "statement": "statement.md",
  "hints": "hints.md",
  "explanation": "explanation.md",
  "tests": "tests.json",
  "languages": {
    "python": {
      "boilerplate": "boilerplate/python.py",
      "solution": "solutions/python.py"
    },
    "javascript": {
      "boilerplate": "boilerplate/javascript.js",
      "solution": "solutions/javascript.js"
    },
    "typescript": {
      "boilerplate": "boilerplate/typescript.ts",
      "solution": "solutions/typescript.ts"
    },
    "java": {
      "boilerplate": "boilerplate/java.java",
      "solution": "solutions/java.java"
    },
    "cpp": {
      "boilerplate": "boilerplate/cpp.cpp",
      "solution": "solutions/cpp.cpp"
    },
    "go": {
      "boilerplate": "boilerplate/go.go",
      "solution": "solutions/go.go"
    }
  }
}
