{
  "$schema": "../../schema/meta.schema.json",
  "id": 167,
  "slug": "merge-strings-alternately",
  "title": "Merge Strings Alternately",
  "difficulty": "easy",
  "tags": [
    "strings",
    "two-pointers"
  ],
  "companies": [
    "amazon",
    "uber"
  ],
  "target_minutes": 15,
  "signature": {
    "function": "merge_alternately",
    "params": [
      {
        "name": "word1",
        "type": "string"
      },
      {
        "name": "word2",
        "type": "string"
      }
    ],
    "returns": "string"
  },
  "statement": "statement.md",
  "hints": "hints.md",
  "explanation": "explanation.md",
  "tests": "tests.json",
  "languages": {
    "python": {
      "boilerplate": "boilerplate/python.py",
      "solution": "solutions/python.py"
    },
    "javascript": {
      "boilerplate": "boilerplate/javascript.js",
      "solution": "solutions/javascript.js"
    },
    "typescript": {
      "boilerplate": "boilerplate/typescript.ts",
      "solution": "solutions/typescript.ts"
    },
    "java": {
      "boilerplate": "boilerplate/java.java",
      "solution": "solutions/java.java"
    },
    "cpp": {
      "boilerplate": "boilerplate/cpp.cpp",
      "solution": "solutions/cpp.cpp"
    },
    "go": {
      "boilerplate": "boilerplate/go.go",
      "solution": "solutions/go.go"
    }
  }
}
