{
  "$schema": "../../schema/meta.schema.json",
  "id": 117,
  "slug": "word-pattern",
  "title": "Word Pattern",
  "difficulty": "easy",
  "tags": [
    "strings",
    "hash-map"
  ],
  "companies": [
    "dropbox",
    "uber",
    "amazon"
  ],
  "target_minutes": 15,
  "signature": {
    "function": "word_pattern",
    "params": [
      {
        "name": "pattern",
        "type": "string"
      },
      {
        "name": "s",
        "type": "string"
      }
    ],
    "returns": "bool"
  },
  "statement": "statement.md",
  "hints": "hints.md",
  "explanation": "explanation.md",
  "tests": "tests.json",
  "languages": {
    "python": {
      "boilerplate": "boilerplate/python.py",
      "solution": "solutions/python.py"
    },
    "javascript": {
      "boilerplate": "boilerplate/javascript.js",
      "solution": "solutions/javascript.js"
    },
    "typescript": {
      "boilerplate": "boilerplate/typescript.ts",
      "solution": "solutions/typescript.ts"
    },
    "java": {
      "boilerplate": "boilerplate/java.java",
      "solution": "solutions/java.java"
    },
    "cpp": {
      "boilerplate": "boilerplate/cpp.cpp",
      "solution": "solutions/cpp.cpp"
    },
    "go": {
      "boilerplate": "boilerplate/go.go",
      "solution": "solutions/go.go"
    }
  }
}
