{
  "$schema": "../../schema/meta.schema.json",
  "id": 471,
  "slug": "top-k-frequent-words",
  "title": "Top K Frequent Words",
  "difficulty": "medium",
  "tags": [
    "heap",
    "hash-map",
    "sorting",
    "strings"
  ],
  "companies": [
    "amazon",
    "bloomberg",
    "uber"
  ],
  "target_minutes": 25,
  "signature": {
    "function": "top_k_frequent_words",
    "params": [
      {
        "name": "words",
        "type": "string[]"
      },
      {
        "name": "k",
        "type": "int"
      }
    ],
    "returns": "string[]"
  },
  "statement": "statement.md",
  "hints": "hints.md",
  "explanation": "explanation.md",
  "tests": "tests.json",
  "languages": {
    "python": {
      "boilerplate": "boilerplate/python.py",
      "solution": "solutions/python.py"
    },
    "javascript": {
      "boilerplate": "boilerplate/javascript.js",
      "solution": "solutions/javascript.js"
    },
    "typescript": {
      "boilerplate": "boilerplate/typescript.ts",
      "solution": "solutions/typescript.ts"
    },
    "java": {
      "boilerplate": "boilerplate/java.java",
      "solution": "solutions/java.java"
    },
    "cpp": {
      "boilerplate": "boilerplate/cpp.cpp",
      "solution": "solutions/cpp.cpp"
    },
    "go": {
      "boilerplate": "boilerplate/go.go",
      "solution": "solutions/go.go"
    }
  }
}
