{
  "$schema": "../../schema/meta.schema.json",
  "id": 268,
  "slug": "next-greatest-letter",
  "title": "Find Smallest Letter Greater Than Target",
  "difficulty": "easy",
  "tags": [
    "binary-search",
    "strings"
  ],
  "companies": [
    "linkedin",
    "amazon"
  ],
  "target_minutes": 15,
  "signature": {
    "function": "next_greatest_letter",
    "params": [
      {
        "name": "letters",
        "type": "string[]"
      },
      {
        "name": "target",
        "type": "string"
      }
    ],
    "returns": "string"
  },
  "statement": "statement.md",
  "hints": "hints.md",
  "explanation": "explanation.md",
  "tests": "tests.json",
  "languages": {
    "python": {
      "boilerplate": "boilerplate/python.py",
      "solution": "solutions/python.py"
    },
    "javascript": {
      "boilerplate": "boilerplate/javascript.js",
      "solution": "solutions/javascript.js"
    },
    "typescript": {
      "boilerplate": "boilerplate/typescript.ts",
      "solution": "solutions/typescript.ts"
    },
    "java": {
      "boilerplate": "boilerplate/java.java",
      "solution": "solutions/java.java"
    },
    "cpp": {
      "boilerplate": "boilerplate/cpp.cpp",
      "solution": "solutions/cpp.cpp"
    },
    "go": {
      "boilerplate": "boilerplate/go.go",
      "solution": "solutions/go.go"
    }
  }
}
