{
  "$schema": "../../schema/meta.schema.json",
  "id": 374,
  "slug": "merge-two-binary-trees",
  "title": "Merge Two Binary Trees",
  "difficulty": "easy",
  "tags": [
    "trees",
    "dfs",
    "recursion"
  ],
  "companies": [
    "amazon",
    "adobe"
  ],
  "target_minutes": 12,
  "signature": {
    "function": "merge_trees",
    "params": [
      {
        "name": "root1",
        "type": "TreeNode"
      },
      {
        "name": "root2",
        "type": "TreeNode"
      }
    ],
    "returns": "TreeNode"
  },
  "statement": "statement.md",
  "hints": "hints.md",
  "explanation": "explanation.md",
  "tests": "tests.json",
  "languages": {
    "python": {
      "boilerplate": "boilerplate/python.py",
      "solution": "solutions/python.py"
    },
    "javascript": {
      "boilerplate": "boilerplate/javascript.js",
      "solution": "solutions/javascript.js"
    },
    "typescript": {
      "boilerplate": "boilerplate/typescript.ts",
      "solution": "solutions/typescript.ts"
    },
    "java": {
      "boilerplate": "boilerplate/java.java",
      "solution": "solutions/java.java"
    },
    "cpp": {
      "boilerplate": "boilerplate/cpp.cpp",
      "solution": "solutions/cpp.cpp"
    },
    "go": {
      "boilerplate": "boilerplate/go.go",
      "solution": "solutions/go.go"
    }
  }
}
