{
  "$schema": "../../schema/meta.schema.json",
  "id": 396,
  "slug": "lowest-common-ancestor-of-a-binary-tree",
  "title": "Lowest Common Ancestor of a Binary Tree",
  "difficulty": "medium",
  "tags": [
    "trees",
    "dfs"
  ],
  "companies": [
    "meta",
    "amazon",
    "microsoft",
    "linkedin"
  ],
  "target_minutes": 25,
  "signature": {
    "function": "lowest_common_ancestor",
    "params": [
      {
        "name": "root",
        "type": "TreeNode"
      },
      {
        "name": "p",
        "type": "int"
      },
      {
        "name": "q",
        "type": "int"
      }
    ],
    "returns": "int"
  },
  "statement": "statement.md",
  "hints": "hints.md",
  "explanation": "explanation.md",
  "tests": "tests.json",
  "languages": {
    "python": {
      "boilerplate": "boilerplate/python.py",
      "solution": "solutions/python.py"
    },
    "javascript": {
      "boilerplate": "boilerplate/javascript.js",
      "solution": "solutions/javascript.js"
    },
    "typescript": {
      "boilerplate": "boilerplate/typescript.ts",
      "solution": "solutions/typescript.ts"
    },
    "java": {
      "boilerplate": "boilerplate/java.java",
      "solution": "solutions/java.java"
    },
    "cpp": {
      "boilerplate": "boilerplate/cpp.cpp",
      "solution": "solutions/cpp.cpp"
    },
    "go": {
      "boilerplate": "boilerplate/go.go",
      "solution": "solutions/go.go"
    }
  }
}
